{
  "$schema": "http://json-schema.org/draft-07/schema#",
  "title": "Agent Tool Description Format (ATDF) Schema",
  "description": "Schema for validating ATDF tool descriptions, ensuring they conform to the protocol's structure.",
  "type": "object",
  "properties": {
    "schema_version": {
      "type": "string",
      "description": "Version of the schema being used.",
      "default": "1.0.0"
    },
    "tool_id": {
      "type": "string",
      "description": "Unique identifier for the tool.",
      "minLength": 1
    },
    "id": {
      "type": "string",
      "description": "Alternative identifier for the tool (alias for tool_id).",
      "minLength": 1
    },
    "description": {
      "type": "string",
      "description": "A concise explanation of what the tool does, avoiding technical details.",
      "minLength": 1
    },
    "when_to_use": {
      "type": "string",
      "description": "The context or conditions under which the tool should be used.",
      "minLength": 1
    },
    "how_to_use": {
      "type": "object",
      "description": "Details the operation of the tool, including inputs and outputs.",
      "properties": {
        "inputs": {
          "type": "array",
          "description": "List of input parameters required to use the tool.",
          "items": {
            "type": "object",
            "properties": {
              "name": {
                "type": "string",
                "description": "Name of the input parameter.",
                "minLength": 1
              },
              "type": {
                "type": "string",
                "description": "Data type of the input (e.g., string, number).",
                "minLength": 1
              },
              "description": {
                "type": "string",
                "description": "Optional description of the input parameter's purpose."
              }
            },
            "required": ["name", "type"],
            "additionalProperties": false
          }
        },
        "outputs": {
          "type": "object",
          "description": "Possible results of using the tool.",
          "properties": {
            "success": {
              "type": "string",
              "description": "Message indicating successful operation.",
              "minLength": 1
            },
            "failure": {
              "type": "array",
              "description": "List of possible errors.",
              "items": {
                "type": "object",
                "properties": {
                  "code": {
                    "type": "string",
                    "description": "Unique identifier for the error.",
                    "minLength": 1
                  },
                  "description": {
                    "type": "string",
                    "description": "Explanation of the error.",
                    "minLength": 1
                  }
                },
                "required": ["code", "description"],
                "additionalProperties": false
              }
            }
          },
          "required": ["success", "failure"],
          "additionalProperties": false
        }
      },
      "required": ["inputs", "outputs"],
      "additionalProperties": false
    }
  },
  "required": ["description", "when_to_use", "how_to_use"],
  "oneOf": [
    {"required": ["tool_id"]},
    {"required": ["id"]}
  ],
  "additionalProperties": false
}
