{
  "tool_id": "hole_maker_v1",
  "description": "Creates holes in various surfaces",
  "when_to_use": "Use when you need to make a hole in a wall, wood, metal, or other solid surface.",
  "how_to_use": {
    "inputs": [
      {
        "name": "diameter",
        "type": "number",
        "description": "The diameter of the hole in millimeters"
      },
      {
        "name": "surface_type",
        "type": "string",
        "description": "Type of surface (e.g., wall, wood, metal)"
      },
      {
        "name": "depth",
        "type": "number",
        "description": "The depth of the hole in millimeters"
      }
    ],
    "outputs": {
      "success": "The hole has been created with the specified parameters.",
      "failure": [
        {
          "code": "invalid_diameter",
          "description": "The diameter must be between 1mm and 100mm."
        },
        {
          "code": "invalid_surface",
          "description": "The surface type is not supported."
        },
        {
          "code": "invalid_depth",
          "description": "The depth must be between 1mm and 500mm."
        }
      ]
    }
  }
}
