{
  "tool_id": "hole_maker_v1",
  "description": "Permite crear agujeros en superficies sólidas",
  "when_to_use": "Usar cuando necesites generar un agujero en una pared u otra superficie perforable",
  "how_to_use": {
    "inputs": [
      {
        "name": "location",
        "type": "string",
        "description": "Ubicación del agujero (e.g., 'x:10,y:20' o descripción textual)"
      },
      {
        "name": "bit_id",
        "type": "string",
        "description": "Identificador de la broca a usar (e.g., 'BIT_5MM')"
      }
    ],
    "outputs": {
      "success": "Agujero creado con éxito",
      "failure": [
        {
          "code": "invalid_bit",
          "description": "La broca seleccionada no es compatible con la superficie"
        },
        {
          "code": "invalid_surface",
          "description": "La superficie no es perforable (e.g., vidrio no soportado)"
        }
      ]
    }
  }
} 