{
  "tool_id": "text_translator_v1",
  "description": "Translates text between different languages",
  "when_to_use": "Use when you need to translate text from one language to another.",
  "how_to_use": {
    "inputs": [
      {
        "name": "source_text",
        "type": "string",
        "description": "The text to be translated"
      },
      {
        "name": "source_language",
        "type": "string",
        "description": "The language code of the source text (e.g., 'en', 'es', 'fr')"
      },
      {
        "name": "target_language",
        "type": "string",
        "description": "The language code to translate the text to (e.g., 'en', 'es', 'fr')"
      }
    ],
    "outputs": {
      "success": "The text has been successfully translated to the target language.",
      "failure": [
        {
          "code": "unsupported_language",
          "description": "One or both of the specified languages are not supported."
        },
        {
          "code": "empty_text",
          "description": "The source text cannot be empty."
        },
        {
          "code": "translation_error",
          "description": "An error occurred during translation."
        }
      ]
    }
  }
}
